{
  "schemaVersion": 2,
  "changeId": "example-standard-feature",
  "title": "Example standard feature readiness evidence",
  "owner": "Forgevena maintainers",
  "changeType": "feature",
  "profile": "standard-code",
  "riskTier": "tier-1",
  "checkpoint": "merge",
  "version": "example",
  "maturity": "stable",
  "scope": "Demonstrate a complete machine-readable merge-readiness assessment.",
  "affectedComponents": ["governance documentation", "validation tests"],
  "moduleAssessments": [
    { "component": "governance documentation", "criticality": "important", "requiredScore": 95, "applicablePoints": 100, "earnedScore": 100, "score": 100, "status": "pass", "rationale": "Canonical governance changes require complete documentation validation.", "evidence": ["docs/governance/CHANGE_READINESS_SCORECARD.md"], "criteria": [{ "id": "governance-docs", "description": "Canonical rules, schema, migration, and examples agree", "points": 100, "mandatory": true, "status": "pass", "rationale": "", "evidence": ["docs/governance/CHANGE_READINESS_SCORECARD.md"] }] },
    { "component": "validation tests", "criticality": "critical", "requiredScore": 100, "applicablePoints": 100, "earnedScore": 100, "score": 100, "status": "pass", "rationale": "The fail-closed validation engine is a critical governance control.", "evidence": ["test/change-readiness.test.js"], "criteria": [{ "id": "validation-contract", "description": "All fail-closed scoring and governance tests pass", "points": 100, "mandatory": true, "status": "pass", "rationale": "", "evidence": ["test/change-readiness.test.js"] }] }
  ],
  "requirements": ["Show all scoring domains", "Retain evidence for audit"],
  "nonGoals": ["Authorize a real production change"],
  "evidenceLinks": ["docs/governance/CHANGE_READINESS_SCORECARD.md", "test/change-readiness.test.js"],
  "categories": [
    { "id": "product-governance", "weight": 6, "status": "pass", "applicablePoints": 6, "earnedScore": 6, "scorePercent": 100, "items": [{ "id": "product-1", "description": "Requirements and ownership are documented", "points": 6, "mandatory": true, "status": "pass", "rationale": "", "evidence": ["docs/governance/CHANGE_READINESS_SCORECARD.md"] }], "findings": [], "evidence": ["docs/governance/CHANGE_READINESS_SCORECARD.md"] },
    { "id": "architecture-system-design", "weight": 8, "status": "pass", "applicablePoints": 8, "earnedScore": 8, "scorePercent": 100, "items": [{ "id": "architecture-1", "description": "Architecture impact is bounded and reviewed", "points": 8, "mandatory": true, "status": "pass", "rationale": "", "evidence": ["docs/strategy/PLATFORM_CONSTITUTION.md"] }], "findings": [], "evidence": ["docs/strategy/PLATFORM_CONSTITUTION.md"] },
    { "id": "code-quality-maintainability", "weight": 8, "status": "pass", "applicablePoints": 8, "earnedScore": 8, "scorePercent": 100, "items": [{ "id": "code-1", "description": "Implementation follows repository quality rules", "points": 8, "mandatory": true, "status": "pass", "rationale": "", "evidence": ["AGENTS.md"] }], "findings": [], "evidence": ["AGENTS.md"] },
    { "id": "security-privacy-trust", "weight": 10, "status": "pass", "applicablePoints": 10, "earnedScore": 10, "scorePercent": 100, "items": [{ "id": "security-1", "description": "Security and privacy impact is reviewed", "points": 10, "mandatory": true, "status": "pass", "rationale": "", "evidence": ["docs/strategy/PLATFORM_CONSTITUTION.md"] }], "findings": [], "evidence": ["docs/strategy/PLATFORM_CONSTITUTION.md"] },
    { "id": "testing-quality-assurance", "weight": 12, "status": "pass", "applicablePoints": 12, "earnedScore": 12, "scorePercent": 100, "items": [{ "id": "testing-1", "description": "Automated validation covers the contract", "points": 12, "mandatory": true, "status": "pass", "rationale": "", "evidence": ["test/change-readiness.test.js"] }], "findings": [], "evidence": ["test/change-readiness.test.js"] },
    { "id": "reliability-recovery-rollback", "weight": 8, "status": "pass", "applicablePoints": 8, "earnedScore": 8, "scorePercent": 100, "items": [{ "id": "reliability-1", "description": "Failure and rollback implications are documented", "points": 8, "mandatory": true, "status": "pass", "rationale": "", "evidence": ["docs/ENGINEERING_GOVERNANCE.md"] }], "findings": [], "evidence": ["docs/ENGINEERING_GOVERNANCE.md"] },
    { "id": "performance-scalability-cost", "weight": 6, "status": "pass", "applicablePoints": 6, "earnedScore": 6, "scorePercent": 100, "items": [{ "id": "performance-1", "description": "Performance and cost impact is assessed", "points": 6, "mandatory": false, "status": "pass", "rationale": "", "evidence": ["docs/governance/CHANGE_READINESS_SCORECARD.md"] }], "findings": [], "evidence": ["docs/governance/CHANGE_READINESS_SCORECARD.md"] },
    { "id": "api-contracts-data", "weight": 6, "status": "pass", "applicablePoints": 6, "earnedScore": 6, "scorePercent": 100, "items": [{ "id": "api-1", "description": "Schema contract remains explicit and versioned", "points": 6, "mandatory": true, "status": "pass", "rationale": "", "evidence": ["docs/reference/schemas/change-readiness-scorecard.schema.json"] }], "findings": [], "evidence": ["docs/reference/schemas/change-readiness-scorecard.schema.json"] },
    { "id": "frontend-uiux-accessibility", "weight": 6, "status": "pass", "applicablePoints": 6, "earnedScore": 6, "scorePercent": 100, "items": [{ "id": "frontend-1", "description": "Rendered documentation remains accessible", "points": 6, "mandatory": false, "status": "pass", "rationale": "", "evidence": ["website/mkdocs.yml"] }], "findings": [], "evidence": ["website/mkdocs.yml"] },
    { "id": "backend-integrations-concurrency", "weight": 6, "status": "pass", "applicablePoints": 6, "earnedScore": 6, "scorePercent": 100, "items": [{ "id": "backend-1", "description": "Validation integration is deterministic", "points": 6, "mandatory": false, "status": "pass", "rationale": "", "evidence": ["src/change-readiness.js"] }], "findings": [], "evidence": ["src/change-readiness.js"] },
    { "id": "devops-supply-chain", "weight": 8, "status": "pass", "applicablePoints": 8, "earnedScore": 8, "scorePercent": 100, "items": [{ "id": "devops-1", "description": "Repository quality commands verify the change", "points": 8, "mandatory": true, "status": "pass", "rationale": "", "evidence": ["package.json"] }], "findings": [], "evidence": ["package.json"] },
    { "id": "documentation-developer-experience", "weight": 6, "status": "pass", "applicablePoints": 6, "earnedScore": 6, "scorePercent": 100, "items": [{ "id": "documentation-1", "description": "Usage and evidence retention are documented", "points": 6, "mandatory": true, "status": "pass", "rationale": "", "evidence": ["docs/evidence/changes/README.md"] }], "findings": [], "evidence": ["docs/evidence/changes/README.md"] },
    { "id": "compatibility-versioning-release", "weight": 6, "status": "pass", "applicablePoints": 6, "earnedScore": 6, "scorePercent": 100, "items": [{ "id": "compatibility-1", "description": "The change introduces no runtime compatibility break", "points": 6, "mandatory": true, "status": "pass", "rationale": "", "evidence": ["docs/governance/CHANGE_READINESS_SCORECARD.md"] }], "findings": [], "evidence": ["docs/governance/CHANGE_READINESS_SCORECARD.md"] },
    { "id": "observability-support-sustainability", "weight": 4, "status": "pass", "applicablePoints": 4, "earnedScore": 4, "scorePercent": 100, "items": [{ "id": "operations-1", "description": "Ownership and operational evidence are retained", "points": 4, "mandatory": false, "status": "pass", "rationale": "", "evidence": ["docs/evidence/changes/README.md"] }], "findings": [], "evidence": ["docs/evidence/changes/README.md"] }
  ],
  "blockers": [
    { "id": "B-01", "description": "Required quality checks fail", "status": "clear", "rationale": "", "evidence": ["test/change-readiness.test.js"] },
    { "id": "B-02", "description": "Critical security finding or secret exposure exists", "status": "clear", "rationale": "", "evidence": ["docs/strategy/PLATFORM_CONSTITUTION.md"] },
    { "id": "B-03", "description": "User files are overwritten or unmanaged assets deleted", "status": "clear", "rationale": "", "evidence": ["AGENTS.md"] },
    { "id": "B-04", "description": "Architecture or trust-boundary approval is missing", "status": "clear", "rationale": "", "evidence": ["docs/ENGINEERING_GOVERNANCE.md"] },
    { "id": "B-05", "description": "Breaking contract lacks migration and rollback", "status": "clear", "rationale": "", "evidence": ["docs/ENGINEERING_GOVERNANCE.md"] },
    { "id": "B-06", "description": "Managed mutation lacks recovery evidence", "status": "clear", "rationale": "", "evidence": ["docs/ENGINEERING_GOVERNANCE.md"] },
    { "id": "B-07", "description": "Maturity or compatibility claim is unsupported", "status": "clear", "rationale": "", "evidence": ["docs/governance/compatibility-evidence.json"] },
    { "id": "B-08", "description": "Waiver is invalid, expired, or prohibited", "status": "clear", "rationale": "", "evidence": ["docs/governance/waivers.json"] },
    { "id": "B-09", "description": "Supply-chain or licensing policy fails", "status": "clear", "rationale": "", "evidence": ["package.json"] },
    { "id": "B-10", "description": "Release versions or artifacts disagree", "status": "clear", "rationale": "", "evidence": ["VERSION"] },
    { "id": "B-11", "description": "User-facing accessibility review is missing", "status": "clear", "rationale": "", "evidence": ["website/mkdocs.yml"] },
    { "id": "B-12", "description": "External effect lacks consent", "status": "clear", "rationale": "", "evidence": ["docs/strategy/PLATFORM_CONSTITUTION.md"] }
  ],
  "assessments": {
    "tests": ["Automated contract tests pass"],
    "security": ["No new trust boundary or secret handling"],
    "compatibility": ["Documentation-only public contract addition"],
    "migration": ["No migration required"],